{
  "id": 1399,
  "name": "Game of Thrones",
  "original_name": "Game of Thrones",
  "overview": "Nine noble families wage war against each other for control over the lands of Westeros.",
  "tagline": "Winter is coming.",
  "first_air_date": "2011-04-17",
  "last_air_date": "2019-05-19",
  "episode_run_time": [55, 60],
  "number_of_seasons": 8,
  "number_of_episodes": 73,
  "genres": [
    { "id": 10765, "name": "Sci-Fi & Fantasy" },
    { "id": 18, "name": "Drama" }
  ],
  "networks": [
    { "id": 49, "name": "HBO", "logo_path": "/hbo.png", "origin_country": "US" }
  ],
  "production_companies": [
    {
      "id": 76043,
      "name": "HBO",
      "logo_path": "/hbo.png",
      "origin_country": "US",
      "description": null,
      "headquarters": null,
      "homepage": "https://www.hbo.com",
      "produced_movies": [],
      "produced_series": []
    }
  ],
  "origin_country": ["US"],
  "poster_path": "/got-poster.jpg",
  "backdrop_path": "/got-backdrop.jpg",
  "vote_average": 8.4,
  "vote_count": 21000,
  "popularity": 300.2,
  "homepage": "https://www.hbo.com/game-of-thrones",
  "external_ids": { "imdb_id": "tt0944947" },
  "seasons": [
    {
      "season_number": 1,
      "name": "Season 1",
      "overview": "Introduction to the Seven Kingdoms.",
      "air_date": "2011-04-17",
      "episode_count": 10,
      "poster_path": "/s1.jpg",
      "cast": [
        {
          "id": 1223786,
          "name": "Emilia Clarke",
          "character": "Daenerys Targaryen",
          "profile_path": "/emilia-clarke.jpg",
          "order": 0
        }
      ],
      "crew": [
        {
          "id": 98123,
          "name": "David Benioff",
          "job": "Writer",
          "department": "Writing",
          "profile_path": "/david-benioff.jpg"
        }
      ],
      "episodes": [
        {
          "episode_number": 1,
          "name": "Winter Is Coming",
          "overview": "The Starks of Winterfell are introduced.",
          "air_date": "2011-04-17",
          "runtime": 62,
          "still_path": "/s1e1.jpg",
          "vote_average": 8.6,
          "vote_count": 4500
        }
      ]
    }
  ],
  "videos": [],
  "images": [],
  "recommendations": [
    { "id": 615, "name": "The Sopranos" }
  ],
  "similar": [
    { "id": 1412, "name": "Arrow" }
  ]
}
